{
  "schema_version": "2.0",
  "event_id": "synthetic_event",
  "study_area": {
    "identifier": "synthetic_area",
    "boundary": "synthetic/study_area.geojson",
    "coordinate_reference_system": "EPSG:32650"
  },
  "inputs": {
    "pre_event": {
      "asset_id": "synthetic_pre",
      "path": "synthetic/pre_event.tif",
      "acquired_at": "2026-10-26T12:00:00+08:00",
      "source": "synthetic_fixture",
      "coordinate_reference_system": "EPSG:32650",
      "pixel_size_m": 0.5,
      "bands": [
        "VV",
        "VH",
        "R",
        "G",
        "B"
      ],
      "footprint": null,
      "source_type": "satellite",
      "is_substitute": false,
      "quality_notes": "synthetic contract fixture only"
    },
    "post_event": {
      "asset_id": "synthetic_post",
      "path": "synthetic/post_event.tif",
      "acquired_at": "2026-10-26T12:00:00+08:00",
      "source": "synthetic_fixture",
      "coordinate_reference_system": "EPSG:32650",
      "pixel_size_m": 0.5,
      "bands": [
        "VV",
        "VH",
        "R",
        "G",
        "B"
      ],
      "footprint": null,
      "source_type": "satellite",
      "is_substitute": false,
      "quality_notes": "synthetic contract fixture only"
    },
    "study_area_id": "synthetic_area",
    "grid": {
      "transform": [
        0.5,
        0.0,
        500000.0,
        0.0,
        -0.5,
        4400000.0
      ],
      "width": 32,
      "height": 32,
      "pixel_size_x_m": 0.5,
      "pixel_size_y_m": 0.5
    },
    "valid_mask": "synthetic/valid_mask.tif"
  },
  "options": {
    "polarizations": [
      "VV",
      "VH"
    ],
    "post_thresholds_db": {
      "VV": -16.0,
      "VH": -23.0
    },
    "pre_water_thresholds_db": {
      "VV": -15.0,
      "VH": -22.0
    },
    "polarization_rule": "all",
    "permanent_water_mask": null,
    "exclusion_mask": null,
    "min_patch_area_m2": 20.0,
    "method": "sar_post_threshold"
  },
  "output_dir": "synthetic/output/stage1"
}
